NO,DEPARTMAN,FAALİYET,İLGİLİ_TARAF,RİSK,OLASI_BOYUT,POTANSİYEL_FIRSATLAR,BAGLAM_IC,BAGLAM_DIS,OLASILIK,ETKI_ISG,ETKI_CEVRE,ETKI_KALITE,ETKI_FINANSAL,ETKI_DEGERI,TOPLAM_RISK_PUANI,RISK_DERECESI,FIRSAT_OLASILIK,FIRSAT_SIKLIK,FIRSAT_SIDDET,FIRSAT_DEGERI,FIRSAT_DERECESI,MEVCUT_DURUM,ALINACAK_TEDBIRLER,SORUMLU,SURE,BUTCE,SON_OLASILIK,SON_ISG,SON_CEVRE,SON_KALITE,SON_FINANSAL,SON_ETKI_DEGERI,SON_RISK_PUANI,SON_RISK_DERECESI,KAYITLAR,DURUM_ACIK,DURUM_KAPALI
1,KALİTE,KALİTE GÜVENCE,SÜREÇLER,DEĞİŞİKLİK YÖNETİMİNİN AKTİF OLMAYIŞI,"YENİ TEDARİKÇİYE GEÇİŞ ZORLUĞU, OLASI DEĞİŞİKLİKLERDE RİSKLER İLE DAHA SIK KARŞILAŞMA",,X,,3,,,3,,3,9,Dikkate Değer Risk,,,,,,HALİHAZIRDA DEĞİŞİKLİK YÖNETİMİ AKTİF UYGULANMAMAKTADIR.,ALTERNATİF VE YENİ TEDARİKÇİ SEÇİMLERİNDE PLANLAMA SATINALMA KALİTE VE ÜRETİM BİRİMLERİ BİR ARAYA GELEREK DEĞERLENDİRME TOPLANTISI YAPMAKTA,KALİTE KONTROL UZMANI,2025-11-01,,2,,,2,,2,4,Kabul Edilebilir Risk,DEĞİŞİKLİK YÖNETİM FORMU,,
2,KALİTE,KALİTE KONTROL,SÜREÇLER,ÜRETİMDE BULUNAN ÖLÇÜM CİHAZLARININ ESKİ VEYA HASARLI OLMASI,"HATALARI ÜRETİM, MÜŞTERİ MEMNUNİYETİNDE AZALMA",,,X,4,,,4,,4,16,Kabul Edilemez Risk,,,,,,ÖLÇÜM CİHAZLARI KALİBRASYON DÖNEMLERİNDE KONTROL EDİLMEKTEDİR.,SENEDE BİR DEFA ÜRETİM İÇ TETKİKİNDE TÜM CİHAZLARIN DOĞRULANMASI,KALİTE YÖNETİM SİSTEMİ UZMANI,2025-04-01,,2,,,4,3,4,8,Dikkate Değer Risk,FR.KY.22 Listesi,,
3,KALİTE,KALİTE KONTROL,SÜREÇLER,ÖZEL ÜRÜNLERİN KONTROL EDİLEMEMESİ,SSH ORANLARINDA ARTIŞ,,X,,3,,,3,,3,9,Dikkate Değer Risk,,,,,,ÖZEL ÜRÜN BARKODLARI KONTROL ALTINDADIR.,ÖZEL ÜRÜN KONTROL TALİMATI OLUŞTURULDU VE FORMLAR TOPLANIYOR.,KALİTE UZMANI,2025-05-31,,2,,,2,3,3,6,Kabul Edilebilir Risk,Özel Üretim Kontrol Klasörü,,
4,KALİTE,KALİTE KONTROL,MÜŞTERİ MEMNUNİYETİ,MÜŞTERİ GÖZÜNDEN VERİ ALINAMAMASI,MÜŞTERİ ŞİKAYETLERİNİN ARTMASI,,,X,5,,,3,3,3,15,Kabul Edilemez Risk,,,,,,MÜŞTERİ ZİYARETLERİ YAPILMAMAKTADIR.,2025 İLK ÇEYREĞİNDE MÜŞTERİ ZİYARETLERİ PLANLANACAK VE YAPILACAK.,OPERASYON BİRİMİ,2025-03-10,,2,,,3,2,3,6,Kabul Edilebilir Risk,Müşteri Gözlem Formu,,
5,KALİTE,KALİTE KONTROL,SÜREÇLER,ÜRÜNLERE ŞARTLI KABUL YAPILMASI,UYGUNSUZ ÜRÜNÜN KABULÜ,,X,,3,,,5,3,5,15,Kabul Edilemez Risk,,,,,,ŞARTLI KABUL SÜRECİ NET DEĞİL.,ŞARTLI KABUL PROSEDÜRÜ GÜNCELLENMELİ VE MALİYET YANSITILMALI.,KALİTE / TZY,2025-03-01,,2,,,3,2,3,6,Kabul Edilebilir Risk,Şartlı Kabul Takip,,